{
  "caller_ura": "easynet:///r/example/agent/alice.sdk",
  "callee_ura": "easynet:///r/example/device/dev-a",
  "subject_ura": "easynet:///r/example/device/dev-a",
  "descriptor_version": "1.0.0",
  "nonce_base64": "AQIDBAUGBwgJCgsMDQ4PEA==",
  "causal_context": {
    "form": "none"
  },
  "realm": "example",
  "agent_ura": "easynet:///r/example/agent/alice.main",
  "resume_cursor": {
    "stream": "directory",
    "sequence": 7
  },
  "heartbeat_interval_ms": 30000,
  "metadata": {
    "request_id": "events-directory-subscribe-1"
  }
}
